<<<<<<< HEAD
<<<<<<< HEAD
<!ELEMENT congreso (conferencia+, asistente+, patrocinador+, otro+)>
<!ATTLIST congreso 
    sede NMTOKEN #REQUIRED
    aÃ±o NMTOKEN #REQUIRED > 
    
      <!-- Enumeraciones -->
  <!ENTITY % tiposFormato "(pdf | video | audio)">
  <!ENTITY % nivelesPatrocinio "(oro | plata | bronce)">
    

<!ELEMENT conferencia (ponente+, material*, asistentes?, comentario)>
<!ATTLIST conferencia
    id ID #REQUIRED
    nombre CDATA #REQUIRED
    tipo CDATA #REQUIRED
    duracion NMTOKEN #REQUIRED > 
    
<!ELEMENT ponente EMPTY > 
<!ATTLIST ponente
  id ID #REQUIRED
  nombre CDATA #REQUIRED > 

<!ELEMENT material EMPTY > 
<!ATTLIST material 
    tipo %tiposFormato; #REQUIRED
    formato NMTOKEN #REQUIRED
    estado (disponible | pendiente) #REQUIRED > 

<!ELEMENT asistentes EMPTY > 
<!ATTLIST asistentes refs IDREFS #REQUIRED> 

<!ELEMENT comentario (#PCDATA | destacado)* > 
<!ATTLIST comentario autorRef IDREF #REQUIRED > 
<!ELEMENT destacado (#PCDATA) > 

  <!ENTITY % datosEntidadComunes "id ID #REQUIRED nombre CDATA #REQUIRED">
  
  <!ELEMENT asistente EMPTY > 
  <!ATTLIST asistente 
      id ID #REQUIRED
      nombre CDATA #REQUIRED> 
      
  
      
      
<!ELEMENT patrocinador EMPTY > 
<!ATTLIST patrocinador 
      id ID #REQUIRED 
      nombre CDATA #REQUIRED
      nivel %nivelesPatrocinio; #REQUIRED > 
      
  <!ELEMENT otro EMPTY> 
  <!ATTLIST otro test CDATA "no att" > 
      


  
  
  
  
  
  
  
  
  
  
  
  
  
  
  
  
  
  
  
  
  
=======
=======
>>>>>>> d44b7688ae915873b36101121ca329133bf893e7
<!ENTITY % parametros
  "nucleosNormales NMTOKEN #REQUIRED
  nucleosArtificial NMTOKEN #IMPLIED">

<!ELEMENT ordenadores ( hardware | software)*>
<!ELEMENT hardware (tGrafica+, procesador)>
<!ELEMENT tGrafica (#PCDATA | nvidia)*>
<!ELEMENT procesador EMPTY>
<!ELEMENT nvidia EMPTY>
<!ATTLIST nvidia %parametros; >
<<<<<<< HEAD
<!ELEMENT software EMPTY>
>>>>>>> 005517de7fa308643d021d1625a6c3a91e1fb95d
=======
<!ELEMENT software EMPTY>
>>>>>>> d44b7688ae915873b36101121ca329133bf893e7
